Susanne Vielmetter Los Angeles Projects at The Armory Show 2013,
Spaces Corners at The Armory Show 2013,
Susan Sheehan Gallery at The Armory Show 2013,
Tanya Leighton at The Armory Show 2013,
Tasende Gallery at The Armory Show 2013,
UCCA Limited Editions at The Armory Show 2013,
The Andy Warhol Museum at The Armory Show 2013,
Upstream Gallery  at The Armory Show 2013,
Various Small Fires at The Armory Show 2013,
Two Palms at Armory Show 2013,
Universal Limited Art Editions at The Armory Show 2013,
Vistamare at The Armory Show 2013,
Vivian Horan at The Armory Show 2013,
Whitestone Gallery at Armory Show 2013,
Tang Contemporary Art at Armory Show 2013,
Yancey Richardson Gallery at Armory Show 2013,
Wetterling Gallery at The Armory Show 2013,
bitforms gallery at The Armory Show 2013,
i8 at The Armory Show 2013,
Galería Visor at The Armory Show 2013,
Aspen Wall Posters at the Gonzo Museum,
When Someone Melts a Menhir,
moniquemeloche at The Armory Show 2013,
1976-1995,
New show,
ROCKS + PLANTS,
Sprüth Magers at The Armory Show 2013,
Norbert Bisky | Paraisópolis,
Whitechapel Gallery at The Armory Show 2013,
undefined,
